{
  "device_id": "SKY-EFGH5678-CD34",
  "firmware_version": "v2.0.1",
  "timestamp": "2026-03-03T09:47:30.750Z",
  "sensor_data": {
    "frequency_ghz": 24.0,
    "signal_power_db": -52.8,
    "velocity_mps": 0.3,
    "range_mm": 10.5,
    "angle_deg": 5.2,
    "detected_targets": 8,
    "noise_level_db": -102.3,
    "interference_score": 1.2,
    "tracked_targets": [
      {
        "id": "TGT-000123",
        "distance_m": 125.7,
        "speed_mps": 8.9,
        "azimuth_deg": 45.2,
        "elevation_deg": 2.3,
        "track_confidence": 0.78,
        "signal_quality": 85.2
      },
      {
        "id": "TGT-000124",
        "distance_m": 89.3,
        "speed_mps": -12.5,
        "azimuth_deg": -32.7,
        "elevation_deg": -1.8,
        "track_confidence": 0.82,
        "signal_quality": 79.6
      }
    ]
  },
  "calibration": {
    "last_calibrated": "2026-02-25T09:00:00.000Z",
    "drift_percentage": 4.8,
    "needs_calibration": true,
    "calibration_quality": "fair"
  },
  "environment": {
    "temp_c": -5.2,
    "humidity_pct": 78.9,
    "rain_mm": 2.3,
    "wind_mps": 12.7,
    "visibility_m": 850.0
  },
  "position": {
    "lat": 41.8781,
    "lon": -87.6298,
    "alt_m": 182.0
  },
  "device_metadata": {
    "transmission_id": "TX-20260303-094730-003",
    "seq_num": 15678,
    "battery_pct": 65.8,
    "signal_strength": -78.9,
    "uptime_seconds": 86400
  }
}